"","job_title","job_location","company_name","job_description","city"
"115","Business Intelligence Analyst","Louth","Carrick Recruitment","Work on interesting data lead projects. Deliver automated reporting and ensure data insights are clear. We have a superb new opportunity in the Data Analytics…","Dublin"
"116","Marketing Coordinator/Analyst","Remote","Larvol","Larvol provides data and software solutions to support the competitive intelligence needs of the pharmaceutical and life science industries.","Dublin"
"117","Quality Analyst-Dublin hub-Danish","Dublin","TikTok","Conduct root cause data analysis and summary. Conduct quality assessment work by ensuring and evaluating the quality delivery of the content reviewed in…","Dublin"
"118","Data Lake Analyst","Dublin","Reperio Human Capital","You will create workflows within the QDC platform, working with the company's data infrastructure team. Data Lake Analyst, SQL Server, AWS, Python.","Dublin"
"119","Logistics Operations Analyst","Dublin","PlaceMe","Continue utilisation of new data highlighting opportunities to apply new data and information by creating reporting which aligns with business values.","Dublin"
"120","Investor Relations - Global PLC","South Dublin, County Dublin","Barden FS","Helping to develop and manage relationships with sell-side analysts,. Monitoring analyst reports and collating information and delivering key points,.","Dublin"
"121","CRM Analyst - Betfair International","Dublin","Betfair International","Ability to extract and analyse data from a data warehouse, with the ability to make sense of data from different sources. Are you our next star player?","Dublin"
"122","Wind Analyst","Dublin","ESB","Gathering, validation and analysis of wind data. Experience in energy assessment based on operational data. Business Unit: Engineering and Major Projects.","Dublin"
"123","Tax Analyst","Dublin","TIBCO Software","This is an excellent opportunity for a part qualified or newly qualified (AITI, CTA, ACA, ACCA, CIMA or equivalent) to join our Tax team based in Dublin as a…","Dublin"
"124","Investigator Financial Analyst I","Dublin","Parexel","Maintains project accrual data of investigator payments (Accrued liability). Investigator Financial analysts are expected to build business relationships across…","Dublin"
"125","Data Protection Analyst","Cork","Johnson Controls","Minimum of six (6) years of experience in data security, data protection, data governance or data privacy. Understanding of data protection and data governance…","Dublin"
"126","HR Analyst","Dublin","eShopWorld","Strong data analysis and reporting skills. Qualification in data analytics a distinct advantage. You will have a natural aptitude for data analysis, reporting…","Dublin"
"127","Sales Compensation Administration Analyst, Google Cloud","Dublin","Google","Experience working with SQL and/or R to extract and manipulate quantitative data. Note: By applying to this position your application is automatically submitted…","Dublin"
"128","Business & Operations Analyst","Dublin","Blueface","Data analytics and business analyst skills are desirable. Experience with Tableau or an equivalent data reporting package.","Dublin"
"129","Senior Product Data Analyst","Dublin","SurveyMonkey","Can enhance and challenge with data. You will apply your expertise in quantitative analysis, data visualization and data-mining to tell the story behind the…","Dublin"
"130","CRM Consultant","Dublin","PROVIDENT C.R.M.","Gather requirements, develop design specification documents and also perform tasks such as configuration, testing, data manipulation and documentation;","Dublin"
"131","Procurement Financial Analyst","Dublin","Perrigo Company","The analyst must be able to prioritize, work through interruptions, and multi- task to meet goals and timelines. SAP Pricing and Data Management.","Dublin"
"132","French Technology Customer Success Analyst €40-50,000","Dublin","Origin Multilingual","Analytical with the ability to digest data and produce relevant market reports. A new French Cloud Sales & Success team is being created in Dublin for a leading…","Dublin"
"133","R&D Lab Technician","Cork","PepsiCo","Develop reference files, quality control charts, and graphs on laboratory data. Work with analysts to monitor monthly Key Performance Indicators and report them…","Dublin"
"134","Associate Test Analyst","Letterkenny, County Donegal","SITA","You will be designing scalable and maintainable automated test solutions and specify the requirements for test environments, test data, resources and tools.","Dublin"
"135","Management Analyst (Org & Cost)","Dublin","Bytedance","Significant experience in data analysis, project management, and cross-function workflow processes. TikTok is the leading destination for short-form mobile…","Dublin"
"136","Sourcing Junior Analyst/Expeditor","Dublin","Twitter","Demonstrated skills in rigorous, data driven analyses that drive creative problem solving, proposal preparation, and negotiation.","Dublin"
"137","Senior QC Analyst - Biochemistry & Cell Biology","Dunboyne, County Meath","MSD","Review and approve Analytical Testing data. An amazing opportunity has arisen for a Senior QC Analyst in Biochemistry & Cell Biology at Dunboyne Biologics, our…","Dublin"
"138","Senior Product Data Analyst","Dublin","Teckro Limited","Teckro welcomes the opportunity for a senior data analyst to join and support the product teams with metrics to define, measure effectiveness and drive success…","Dublin"
"139","Russian-speaking Financial Data Analyst","Dublin","Sigmar Recruitment","Attribute the available data in the income statement, balance sheet and cash flow statement in accordance with the collection policy.","Dublin"
"140","Information Security Analyst","Dublin","First Derivatives plc/Kx","Work alongside relevant data protection colleagues in relation to GDPR and data security. Reporting to the Head of Information Security, the Information…","Dublin"
"141","HRIS Analyst (9 Months Contract)","Clondalkin, County Dublin","ARYZTA Careers","Help maintain data integrity in systems and ensuring compliance with legislation e.g. GDPR. Great written and verbal communication skills with the ability to…","Dublin"
"142","Payroll and Benefits Analyst (3-month contract)","Cork","Barden FS","At least 1/2 years of experience in Finance role/analysing data. Here in Barden we are delighted to be working with one of our globally recognised multinational…","Dublin"
"143","Data Analyst (German/ Hebrew Speaking)","Dublin","Intercontinental Exchange","Use excel functions to organize, analyze and create reference data. Help identify trends and causation of inaccurate and/or incomplete data.","Dublin"
"144","Temp Sample Management Analyst","Limerick","Regeneron","This group also acts as a point of contact between various departments within Regeneron and with the external vendors to support activities, timely…","Dublin"
"145","Global Demand Control Analyst","Shannon, County Clare","Zimmer Biomet","The Global Demand Control Analyst is responsible for managing change in the short-term. The incumbent is also responsible for monitoring the performance of the…","Dublin"
"146","Customer Support Analyst - Dublin - Contract","Dublin","TELUS International","You will be data driven and have the ability to see and investigate and research user issues and identify and escalate bugs so they can be resolved as quickly…","Dublin"
"147","Business Process Analyst - 12months contract","Cork","Apple","Apple is a place where extraordinary people gather to do their best work. Together we build products and experiences people once couldn’t have envisioned - and…","Dublin"
"148","Business Analyst, European Fund Operations, Dublin","Dublin","Baillie Gifford","An independent active fund management firm is looking for a Business Analyst to support its investment management and trading oversight activities in relation…","Dublin"
"149","Marketing Science Analyst- Bilingual French & English","Dublin","Analytic Partners","Experience working with big data; building and optimizing 'big data' data pipelines, architectures, and data sets. Our differentiator is – Our People!","Dublin"
"150","Molecular Biology Analyst","Ballina, County Mayo","Charles River Laboratories","Make detailed observations and accurately and precisely record data, summarize data for reports and document all activities performed in accordance with current…","Dublin"
"151","Lead Quant Analyst - Stress Testing - Dublin/London","Dublin","CRISIL LIMITED","Exposure to credit risk data or market risk principles including valuation and pricing models (not modellers). Title: * Business Analysts or PMs Stress testing.","Dublin"
"152","eCommerce Analyst","North Dublin, County Dublin","Connexus Recruit","Draw actionable insights from the data. 3 years’ experience in data analysis. Prepare concise reports and summarise data and trends.","Dublin"
"153","Helpdesk Technician","Dublin","HubSpot","By submitting your application, you agree that HubSpot may collect your personal data for recruiting, global organization planning, and related purposes.","Dublin"
"154","PPC Analyst / Advertising Manager","Remote","Alison","You should be passionate about numbers and data analysis, with strong attention to detail and accuracy. You will have the ability to quickly understand and…","Dublin"
"155","Team Lead, Data Analytics","Dublin","Dataminr","Experience leading, supervising, or managing data analysts. All personal data will be processed in accordance with Dataminir's data privacy notice available…","Dublin"
"156","Financial Analyst","Cork","Purcell O' Leary","The primary role of the P2P Financial Analyst is to provide overall coordination & support for the end to end P2P process.","Dublin"
"157","Financial Analyst, FP&A (Dublin or New York)","Dublin","MongoDB","Implementation of budget and forecasting data in Adaptive Insights to support the forecasting process. Provide a deep source of knowledge across MongoDB's ERP &…","Dublin"
"158","Account Executive | Worldpanel Division","Dublin","KANTAR","Kantar is the world’s leading data, insights and consulting company. Then build stories for our clients that inspire them to make successful decisions using our…","Dublin"
"159","Treasury Analyst","Dublin","Executive Connections","Development of finance leading products data tapes facilitating reporting requirements. Design & coordinate data gap analysis on internal systems to provide…","Dublin"
"160","Data Governance Analyst","Dublin","Morgan McKinley","You will have hands-on experience with managing libraries of data with demonstrated experience in building and managing data governance frameworks.","Dublin"
"161","Territory Analyst (EMEA)","Dublin","MongoDB","Improve internal and external tools and data sources to identify high-propensity accounts. We expect the Territory Management Specialist to drive broad-based…","Dublin"
"162","Senior Business Analyst","Dublin","Expleo","Responsible for needs analysis, task planning, process/data analysis and modelling and/or logical database design with relational databases.","Dublin"
"163","Junior Business Analyst – Contract","Dublin","Eolas Recruitment","Access Management – collating and creating data for review with relevant owners. Audit – review and compilation of data relating to internal and external audit.","Dublin"
"164","Business Analyst","Dublin","Morgan McKinley","Ability to distil complex data/analyses in to understandable information and actions. Ability to deliver analytic rigor relative to the realities of the data.","Dublin"
"165","Senior Performance Marketing Analyst","Dublin","Ding","Commercially minded with experience in interpreting data into meaningful information. Ability to harvest insights from data with proficiency in R/Python.","Dublin"
"166","Pharmaceutical Analyst","Sligo","Dillon Engineering Services","Carry out data calculations and basic statistics. Our client, an essential player in the global life science sector is looking for a Lab Analyst to join their…","Dublin"
"167","Senior Project Controls Engineer, Data Analyst","Dublin","Turner & Townsend","Provide guidance and advice on data quality issues to a wide variety of data providers. Strong analytic and numeracy skills with the ability to understand and…","Dublin"
"168","Senior Researcher","Dublin","Intercom","We're a team of data scientists and researchers who use data — both big and small — to unlock actionable insights about our customers, our products and our…","Dublin"
"169","CRM Consultant","Dublin","ProvidentCRM Limited","Gather requirements, develop design specification documents and also perform tasks such as configuration, testing, data manipulation and documentation;","Dublin"
"170","Business Intelligence Analyst (Remote working on offer)","Dublin","Ascension Group","Our client will offer you a chance to work on a wide range of exciting and interesting data lead projects. This role offers the right candidate an opportunity…","Dublin"
"171","Regulatory Reporting Analyst - Retail","Dublin","Executive Connections","Maintain satisfactory data quality controls and data integrity, including testing of regulatory reporting system changes and upgrades.","Dublin"
"172","Workforce Management Senior Analyst","Dublin","Accenture","Ability to work independently, multi task and meet demanding deadlines Analytical interpretation of data Experience building resourcing models, forecasting and…","Dublin"
"173","Functional Analyst","Cork","PepsiCo","We are currently looking for a Digital Technical/Functional Analyst – to join our team in Carrigaline on contract up to 12 months.","Dublin"
"174","Financial Analyst","Cork","Red Hat Software","Experience working in a business analyst, data analyst, or financial forecasting role. Ability to create reports; experience with model building and data…","Dublin"
"175","Senior Insurance Data Analyst","Dublin","Abrivia","Analyse large data sets and gather all relevant information in relation to the Dublin operation. Job Skill: admin, analyst, Financial Services, Insurance.","Dublin"
"176","Analytical Analyst","Ballina, County Mayo","Charles River Laboratories","Carry out data calculations ,basic statistics and trending. For 70 years, Charles River employees have worked together to assist in the discovery, development…","Dublin"
"177","Quant Risk Analyst","Dublin","Sigmar Recruitment","Be responsible for market data coverage and market risk calculation. Sigmar Recruitment are working with a leading Quant Advisory company as they recruit for a…","Dublin"
"178","Temp QC Micro Analyst","Limerick","Regeneron","Performs peer review of data. Increasing responsibilities for reviewing documents and data. Does this sound like you?","Dublin"
"179","Cyber Security Analyst","Dublin","Alexion Partners","Strong understanding of data security, data classification, and data loss prevention. Proactively look for suspicious abnormal activity based on data alerts or…","Dublin"
"180","Senior QC Analyst (9 Month Fixed Term)","Dublin","Mylan","Analytical data review and trend analysis. The successful candidate may be required to train analysts (as required). Primary Location - IRE-Leinster-Dublin.","Dublin"
"181","Internship - Engineer : carbon footprint analysis","Louth","John Zink Hamworthy Combustion","Developing and automatizing the periodical data collection process. Quantifying and analyzing the collected data in the Carbon calculator.","Dublin"
"182","IFRS17 Group Actuarial Analyst","Dublin","PartnerRe","Advanced IT, data management and modeling skills; knowledge of visual basic and Business Objects reporting would be an advantage. What can we offer you.","Dublin"
"183","Insurance Analyst/Executive","Dublin","Abrivia","Managing the underwriting data by liaising with Underwriters and external service providers to ensure timely and accurate data.","Dublin"
"184","Software Development Engineer","Dublin","DOCOsoft","Specific information flows, processes/procedures, and data objects that will meet the business requirements. Consults with internal and external stakeholders in…","Dublin"
"185","Senior Revenue Analyst","Dublin","Autodesk","Excellent quantitative, analytical and data mining skills. Autodesk revenue analysts are a clever and intelligent bunch who are responsible for the most…","Dublin"
"186","Business Analyst","Dublin","Recruiters","Have you experience working on pulling sales data to create visuals and build dashboards? Enjoy the challenge of working in a fast-paced multinational?","Dublin"
"187","Systems Analyst, SaaS Operations, Charles River Development, Senior Associate","South Dublin, County Dublin","State Street","We provide investment servicing, data & analytics, investment research & trading and investment management to institutional clients. Who we are looking for.","Dublin"
"188","Global Supply Chain Data Analyst","Limerick","Johnson & Johnson Family of Companies","Experience data analytical tools such as Excel,Tableu. Prepare, execute, and manage SAP/APO data extractions, validation, and integration support (multiple data…","Dublin"
"189","Data Warehouse Specialist","Dublin","Eolas Recruitment","Experience with data quality and data profiling. Design and implement ETL procedures for intake of data from both internal and outside sources, as well as…","Dublin"
"190","Sales & Marketing Analyst","South Dublin, County Dublin","CRL Recruitment","Supporting the development of marketing plans by providing market insights through data mining of various internal and external data sources.","Dublin"
"191","Account Executive | Worldpanel Division","Dublin","Kantar TNS","Kantar is the world’s leading data, insights and consulting company. Then build stories for our clients that inspire them to make successful decisions using our…","Dublin"
"192","Financial Analyst","Dublin","Executive Connections","Experience with market data services (Bloomberg, Barclays POINT etc.). Work with our head of reporting and pertinent stakeholders to develop KPIs, reports, and…","Dublin"
"193","AbbVie QC Analyst","Sligo","Abbvie","Aid in the training of new analysts. Responsible for raising change requests and data verification as assigned. Want to make a worldwide impact?","Dublin"
"194","French-speaking Financial Data Analyst","Dublin","Sigmar Recruitment","Attribute the available data in the income statement, balance sheet and cash flow statement in accordance with the collection policy.","Dublin"
"195","Risk and Compliance Analyst","Dublin","Modulr","As a Risk and Compliance analyst at Modulr you will work closely with the Head of Risk and Compliance Modulr Europe in delivering an appropriate Compliance Risk…","Dublin"
"196","Investor Relations Analyst","Dublin","Accpro","Working closely with the manager, you will be responsible for carrying out the IR strategy, preparing complex calculations on trends & data (of both the company…","Dublin"
"197","Graduate CTRM Technical Analyst","Cork","capSpire","Exposure to broad technical skills such as Object Orientated programming (JAVA or C#) relational databases (data modeling/SQL), web UI (design and development),…","Dublin"
"198","Senior Integration Analyst","Dublin","Ornua","3+ years of experience in similar Integration analyst or developer role. This is an ideal role for a technically-minded analyst who enjoys strong business…","Dublin"
"199","Business Intelligence Systems Analyst","Waterford","Teva Pharmaceuticals","A Deep understanding of data quality, reporting and data analysis techniques? We touch the lives of over 200 million patients every day, and billions every year…","Dublin"
"200","Implementations Analyst","Clonakilty, County Cork","Global Shares","Assist with data analysis and data conversion projects. Execute the timely processing of operational transactions, including data management, reconciliation,…","Dublin"
"201","Commercial Finance Analyst (6 month Fixed Term Contract)","Dublin","3 Ireland","Translating raw data into insights on customer behaviour, usage and trends. The successful candidate will rely heavily on data analytics to build financial and…","Dublin"
"202","Business Intelligence/Ops. Analyst","Dublin","Sanderson Recruitment Plc","Manage, control & own big data analysis & supporting teams on understanding data & implementing findings. Continually ensuring the integrity of the savings data…","Dublin"
"203","Data Engineer","Cork","Teamwork.com","An interest in data engineering, data analysis or data science is a must. One of our aims is to democratise access to data & encourage a culture of data-driven…","Dublin"
"204","IT Operational Technology Specialist","Dublin","Irish Water","Historian systems and data with the mainstream IT estate. <U+F0B7> Experience in leading and managing a team of analysts. Role: IT Operational Technology Specialist.","Dublin"
"205","Principal Data Analyst","Dublin","The Panel","Strong knowledge of data querying, data mining, data segmentation and strong quantitative analysis skills. Good experience interpreting data and providing data…","Dublin"
"206","Inbound Sales Development Representative","Dublin","Segment","Segment standardizes and streamlines data infrastructure with a single platform that collects, unifies, and sends data to hundreds of business tools with the…","Dublin"
"207","Algorithmic Trading Systems Developer","Dublin","Susquehanna International Group","Backtesting trading strategies using large volumes of data and interpreting the results. Analysing large complex data sets using a mixture of c# and python to…","Dublin"
"208","Finance Business Analyst","Dublin","Penneys","Some experience with leveraging data analytic technologies. Demonstrate an understanding of the requirements for integrations and data transformation in a…","Dublin"
"209","Trading Operations Analyst","Dublin","Virtu Careers","Operations Analysts not only become experts in the logistics and mechanics of trade clearance and settlement, but they also play a crucial role in the ability…","Dublin"
"210","Data Support Developer","Waterford","Sun Life Financial","Collaborate with data and application architects, business and production system analysts, QA analysts and other system owners in the implementation and support…","Dublin"
"211","Q.C. Analyst - Microbiology","Dunboyne, County Meath","Merck","To review and approve testing data and be proficient in the use of MODA and or Global LIMS systems. An amazing opportunity has arisen for a Q.C.","Dublin"
"212","Business Analyst – Reference Data","Dublin","AIG","Evaluate completeness of available data quality exception reports, suggest improvements, assist in data review and updates; Get to know the business .","Dublin"
"213","AppleCare Operations Finance Analyst (12 month contract)","Cork","Apple","Strong technical skills with an ability to deal with large volumes of data &. Apple is a place where extraordinary people capture to do their best work.","Dublin"
"214","Finance Analyst","Dublin","Barclays","Good data management and financial modelling skills such as Python, Sequel, Access, VBA. Exceptional communication skills, in particular the capability to…","Dublin"
"215","Business Analyst – Permanent","Dublin","Eolas Recruitment","Proficient in writing SQL to query data sets as part of data sourcing analysis. These changes will involve exposure to the front, middle and back office areas…","Dublin"
"216","Business Analyst - Strategic Approaches - Global role - Gaming!","Remote","Recruiters","Must have a strong background in data analytics and business analyst skills. Form part of a 65-strong local team comprised unbelievably driven, smart, data-led…","Dublin"
"217","Senior Regulatory Analyst (60-70k)","Dublin","Engage People","Process data using CSS and other bespoke tools. In response to strong company growth, an exciting opportunity has opened up within the Regulatory Services team…","Dublin"
"218","Asset and Profit Protection Analyst","Dublin","Penneys","Prepare reports on stock loss trends for senior management identifying opportunities for data driven stock loss reduction. Asset and Profit Protection Analyst.","Dublin"
"219","Swedish, Danish or Norwegian Quality Analyst","Dublin","CPL Recruitment","Conduct root cause data analysis and summary. My client, a fast growing social media video app developer, publisher and digital distribution company, is looking…","Dublin"
"220","Business Analyst","Dublin","Jenrick Group","A global innovative financial data provider with over 15,000 employees. Business Analyst - Capital Markets / Post-Trade Processing.","Dublin"
"221","Sales Ops Analyst","Dublin","TIBCO Software","Responsible for evaluating data inputs and helping with organization, cleansing and structuring data as it relates to Salesforce CRM.","Dublin"
"222","Lead Strategist, Trust & Safety","Dublin","Google","Experience analyzing large data sets using up-to-date tools. Experience with SQL, Python, or another data or scripting language.","Dublin"
"223","Senior Investment Data Management Analyst","Dublin","Fidelity Investments","You identify data issues, perform root cause analysis and resolve to improve data quality on time. Participate in data management projects/initiatives that aim…","Dublin"
"224","Information Technology – Data Engineer","Remote","Deutsch Family Wine & Spirits","The ideal candidate is an experienced data pipeline builder and data analyst who enjoys optimizing data systems and building them from the ground up.","Dublin"
"225","Communication Analyst","Dublin","Milestone Technologies","Milestone Technologies, Inc. is a leading IT Managed Services and IT Professional Services solutions provider headquartered in the Bay Area and serving clients…","Dublin"
