"","job_title","job_location","company_name","job_description","city"
"447","SAP ABAP Developer","Limerick","General Motors","SAP ABAP experience on conversions for high volume data. Experience in Loftware, Open Text & data archiving technologies. Experience in SAP ECC, EWM,.","Dublin"
"448","Senior QC Analyst","Sligo","Team Horizon","Calculation of results and reporting of data, including trend analysis as required. Strong analytical skills, ability to analyze data and trends and draw…","Dublin"
"449","Senior Nurse Analyst","Dublin","TCP Homecare","To maintain the highest standards of record keeping and ensure accurate input of data onto IT systems. The Senior Nurse Analyst is an office based nursing…","Dublin"
"450","Workday Systems Analyst Consultant","Dublin","Mackin","Support ongoing reconciliation of absence data between multiple systems. Performed data integrity and gap analyses with strong attention to detail.","Dublin"
"451","IT Risk and Compliance Analyst","Limerick","PBRecruitment Ltd.","A good understanding of ISO 27001 standards, of how data is managed across an enterprise and how data is controlled and used. IT Risk and Compliance Analyst *.","Dublin"
"452","Associate Director/Director Sovereigns for our Dublin, Ireland Office","Dublin","Kroll Bond Rating Agency, LLC","Excellent understanding of macroeconomic and political developments particularly in Europe; knowledge of quantitative and qualitative sovereign credit metrics…","Dublin"
"453","Senior Data Engineer","Dublin","Shutterstock","Knowledge of SQL, data modeling and data warehousing concepts. In this role you will be bringing modern data technologies and practices to enable our talented…","Dublin"
"454","Senior SIEM Consultant","Dublin","GCS Recruitment Ireland","Configuring log sources, complex data on-boarding and troubleshooting log stoppages. This is a technical role to lead SIEM consultancy efforts and mentor a team…","Dublin"
"455","Operations Demand Analyst (perm)","Cork","Apple","You will prepare partner demand data, and conduct detailed analysis to minimise forecast error. You will need strong analytical abilities, and should be able to…","Dublin"
"456","HR Systems Administrator","South Dublin, County Dublin","Link Personnel Services","Reconciliation of SelectHR data to 3E data and liaising with Finance on discrepancies. Producing regular and ad hoc reports and analysing system data.","Dublin"
"457","IT Project Manager","South Dublin, County Dublin","Link Personnel Services","Adhere to data classifications and handling rules. Experience working on the migration of data from one system to another.","Dublin"
"458","UK Quality Assurance specialist","County Cork","Amazon Dev Centre Ireland Ltd","Lead a team of five support operations analysts. The team will on-board native speaking auditing resources for each CS language, creating a central standardized…","Dublin"
"459","Senior Digital Analyst","Dublin","TalentHub","Likely job titles/previous roles would be commercial analyst, data analyst, online marketing or conversion rate optimisation specialist.","Dublin"
"460","Business Analyst - Customer Experience","Cork","Morgan McKinley","Identify opportunities from within the data analysis. Ability to make strong recommendations and will drive the use of data behind all activities.","Dublin"
"461","Application Support Engineer / Analyst","Dublin","The Panel","Strong knowledge of supporting data systems and producing data reports to help in decision making. 2+ years of Business Data Analytics Tools knowledge,…","Dublin"
"462","Data Modeller","Dublin","Ryanair","Solid understanding of data warehouse, BI architecture and related concepts. ETL programming skills, including experience with large code bases, complex data…","Dublin"
"463","IT Application Support – SQL Server","South Dublin, County Dublin","Eolas Recruitment","My client who is based in the Southside Dublin is looking for an Application Support Analyst with a strong knowledge of SQL and some DBA knowledge.","Dublin"
"464","Senior Business Analyst","Dublin","realTime","Deep understanding of data modelling and strong analytical capabilities. Demonstrate in-depth technical capabilities and professional knowledge in operational…","Dublin"
"465","Molecular Biologist Supervisor","County Sligo","Dillon Engineering Services","Responsible for providing feedback on performance to analysts working on Client specific projects. Responsible for ensuring all raw data and test results…","Dublin"
"466","QC Analyst Biopharma","Waterford","FRS Recruitment","Able to perform moderately complex and complex laboratory activities including method development, validation and data interpretation.","Dublin"
"467","Account Executive, Traditional Media Agency (German)","Dublin","Google","Our teams of strategists, analysts, advisers and support specialists collaborate closely to spot and analyze customer needs and trends.","Dublin"
"468","Commercial Financial Analyst","County Mayo","FRS Recruitment","Analyze and evaluate budget and forecast data, calculations and underlying assumptions from both a business and financial perspective.","Dublin"
"469","Insights Manager","Kildare","Abrivia","You have a love of extracting, interpreting, manipulating, summarising high level data and presenting in a concise fashion on PowerPoint for decision making.","Dublin"
"470","Senior Finance Analyst – EMEA","Sligo","LiveTiles","Ability to correlate and analyse data from a wide variety of sources and develop an understanding of business performance based on this data.","Dublin"
"471","Model Optimization Specialist (Polish)","Dublin","TikTok","Experience in ads/content safety or quality analyst related experiences is a plus; Deliver routine tasks such as labelling advertisement data to standardize and…","Dublin"
"472","Analytical Development Chemist","Cork","Thermo Fisher Scientific","Complete analytical data collection, interpretation and characterization of compounds while ensuring proper documentation of experimental data is adhered to.","Dublin"
"473","Field Alliances Manager, Technology Partners - EMEA","Dublin","Fivetran","From our founding until now, our mission has remained the same: to remove the engineering burden from data teams by standardizing and fully automating data…","Dublin"
"474","Senior Credit Analyst","South Dublin, County Dublin","FK International - Financial Search & Selection","Business analytics and ability to interpret market data using Excel and web-based systems. FK International, have been engaged by a leading Irish Plc, who have…","Dublin"
"475","Senior Molecular Biologist","County Sligo","Dillon Engineering Services","Interpret data and troubleshoot assays. Our client, a major player in the global life science sector is looking to build a Molecular Biology Team to join their…","Dublin"
"476","QC Analyst (Raw Materials)","Limerick","Regeneron","Gathers data and documents test results. Completes test records and reviews data. Summary: Performs a variety of chemical or biological analyses on raw…","Dublin"
"477","TA Analyst","Cork","Eli Lilly","Be a subject matter expert in your area of recruitment through knowledge of market data and a strong understand of the GBS business.","Dublin"
"478","Commercial Finance Analyst","Dublin","Ryanair","A commercial mindset with the ability to communicate financial data in a simple and concise manner. Ryanair Holdings plc, Europe’s largest airline group, is the…","Dublin"
"479","SAP Master Data Specialist","Galway","Morgan McKinley","Experience and knowledge in data quality improvement. As the Master Data Specialist, you will report to the Master Data Manager and work closely with Analysts,…","Dublin"
"480","Senior Talent Acquisition Business Partner","Cork","Eli Lilly","Be a subject matter expert in your area of recruitment through knowledge of market data and a strong understand of the GBS business.","Dublin"
"481","Risk Insurance Consultant","Dublin","Finalyse","Act as subject matter expert, business or functional analyst in different risk insurance domains (SII, ALM, ORSA,...).","Dublin"
"482","AWS Lead Data Engineer","Dublin","ResMed","The Lead Data Engineer will support our architects, data analysts and data scientists on data initiatives and will ensure optimal data delivery architecture is…","Dublin"
"483","Senior Continuous Improvement Analyst","Galway","TE Connectivity","Our broad range of connectivity and sensor solutions, proven in the harshest environments, enable advancements in transportation, industrial applications,…","Dublin"
"484","Senior eDiscovery Associate","Dublin","Red Tree Recruitment","ISO 27001 Certification – protection of privacy, integrity, and accessibility of data information in the Cyberspace. Leading/Managing teams in eDiscovery.","Dublin"
"485","Molecular Biologist Senior","County Roscommon","Dillon Engineering Services","Interpret data and troubleshoot assays. Our client, a major player in the global life science sector is looking to build a Molecular Biology Team to join their…","Dublin"
"486","QC Mycoplasma Senior Specialist","Dublin","PSC Biotech","Maintain data integrity and ensure compliance with company SOPs, specifications and cGMP regulations. The candidate will provide support to the team and other…","Dublin"
"487","Snr. Software Engineer Conversation Service","Galway","Genesys","You have worked with and understand SQL, NoSQL, or Key-Value data storage technologies. With a strong track record of innovation and a never-ending desire to be…","Dublin"
"488","Digital Sales Representative - Spain - Top Unmanaged SMB","Dublin","Microsoft","This organization is at the forefront of establishing a new sales model leveraging modern technology and big data and analytics to drive impactful demand…","Dublin"
"489","Model Optimization Specialist (Russian)","Dublin","Bytedance","Experience in ads/content safety or quality analyst related experiences is a plus; Deliver routine tasks such as labelling advertisement data to standardize and…","Dublin"
"490","Supply Chain Analyst, FMCG","Dublin West, County Dublin","Accountancy Solutions","Maintenance and analysis of financial data in a commercial forecasting tool. Our client is a global FMCG brand. The main duties of the role will include:","Dublin"
"491","Laboratory Supervisor - Biosafety & Cell Based Assay","Ballina, County Mayo","Charles River Laboratories","Scheduling daily tasks to analyst, ensuring appropriate workload is not exceeded. Responsible for providing feedback on performance to analysts working on…","Dublin"
"492","Software Engineer","Dublin","Intercom","You'll be part of one of our multidisciplinary product teams, where you will build both back-end and front-end systems, and work closely with designers, product…","Dublin"
"493","Full Stack Software Engineer","Cork","GlobeTech","Analyse and operate on very large data sets. GlobeTech is a global provider of software localisation, translation, QA and data analysis to the multinational IT…","Dublin"
"494","Immunoassay Supervisor","County Mayo","Thornshaw Scientific Recruitment","Scheduling daily tasks to analyst, ensuring appropriate workload is not exceeded. Posted date 30 November 2020. This main duties & responsibilities shall be:","Dublin"
"495","Senior Frontend Engineer","Dublin","Toast","Toast stores data in a set of sharded Postgres databases and utilizes Apache Spark for large scale data workloads including query and batch processing.","Dublin"
"496","Junior SQL Developer","Galway","Reperio Human Capital","2+ years experience working in a data analytical role. Junior SQL Developer, Power BI, Data Analyst. Our client is a multinational organisation with offices in…","Dublin"
"497","Model Optimization Specialist (Arabic)","Dublin","Bytedance","Experience in ads/content safety or quality analyst related experiences is a plus; Deliver routine tasks such as labelling advertisement data to standardize and…","Dublin"
"498","Senior Compliance Officer","Dublin","Abrivia","Job Skill: compliance advisor, compliance analyst, compliance manager, compliance officer, compliance specialist. Applications are in strict confidence.","Dublin"
"499","Analytical Review Job - Flexible Hours","Waterford","FRS Recruitment","QC Data Review Job - Flexible Work Arrangements - Days role- Waterford. If you're interested in working for a successful and dynamic pharmaceutical company in…","Dublin"
"500","Data Architect","Dublin","realTime","Implementation of data governance practices. Create highly available, highly scalable data solutions. Work alongside the infrastructure teams to design an…","Dublin"
"501","SAP Integration Lead","Cork","PepsiCo","We are currently looking for an SAP Integration lead to join our IT in Carrigaline on a permanent basis. We are the concentrate team in PepsiCo (PGCS) working…","Dublin"
"502","Digital Sales Representative - UK - Top Unmanaged SMB","Dublin","Microsoft","This organization is at the forefront of establishing a new sales model leveraging modern technology and big data and analytics to drive impactful demand…","Dublin"
"503","Sr Business Intelligence Engineer","Dublin","Amazon Ireland Sup Svcs Ltd","Implement data ingestion routines both real time and batch using best practices in data modeling, ETL/ELT processes leveraging AWS technologies and Big data…","Dublin"
"504","Investigations Team Lead","Clonskeagh, County Dublin","Fiserv, Inc.","A minimum of 2 years’ experience managing team of support analysts. They also ensure that our data remains secure through their work in cyber-security.","Dublin"
"505","Accounts Payable Manager","Dublin","Wallace Myers International","Work closely with Master-data. Approval for Vendor master data. My client a leading FMCG and distribution company are looking to recruit a strong Accounts…","Dublin"
"506","Digital Sales Representative - Netherlands - Top Unmanaged SMB","Dublin","Microsoft","This organization is at the forefront of establishing a new sales model leveraging modern technology and big data and analytics to drive impactful demand…","Dublin"
"507","Digital Sales Representative - Sweden - Top Unmanaged SMB","Dublin","Microsoft","This organization is at the forefront of establishing a new sales model leveraging modern technology and big data and analytics to drive impactful demand…","Dublin"
"508","Snr. Software Engineer Assignment Service","Galway","Genesys","You have worked with and understand SQL, NoSQL, or Key-Value data storage technologies. With a strong track record of innovation and a never-ending desire to be…","Dublin"
"509","Manager, Business Process","Dublin","PayPal","Utilize data and analytics to define processes gaps, product improvements and policy changes needed to reduce complaints across the PayPal organization.","Dublin"
"510","Commercial Accountant","Dublin","Walters People","Drive continious improvement within reporting cycles, embedding efficiency, accuracy and data integrity through all processes.","Dublin"
"511","Cyber Security Managers & Associate Directors – Dublin","Dublin","Red Tree Recruitment","Cyber Security/Information Security Managers, Associate Directors. On behalf of our client we are looking to recruit a number of experienced Cyber Security…","Dublin"
"512","Forensic Investigations Accountant","Dublin","Red Tree Recruitment","Due to unprecedented growth, we are currently working on behalf of our client to recruit a number of Forensics Accountants. Help with Proposal for Tenders.","Dublin"
"513","Senior Product Manager, Digital Solutions","Dublin","Realex Payments","Product management experience with data management and/ or data visualisation tools would be beneficial. At Global Payments we support businesses across the…","Dublin"
"514","AR Analyst German or Dutch","Cork","Purcell O' Leary","Prepare & present Quarterly Credit Committee data for Global Treasury and Affiliates CFO’s. Purcelloleary Recruitment have been assigned to recruit for an AR…","Dublin"
"515","HR Project & Knowledge Management Analyst","Cork","Logitech","This is the role for someone with a strong HR operations background which combines an understanding of data processes with a real appreciation of generalist HR.","Dublin"
"516","Trust and Safety EMEA Quality Manager","Dublin","Bytedance","Strong communication and data analysis skills. Grow the local content moderation quality teams and oversee their management.","Dublin"
"517","Software Engineer II, Ministry of Users","Dublin","Toast","Toast stores data in a set of sharded Postgres databases and utilizes Apache Spark for large scale data workloads including query and batch processing.","Dublin"
"518","IT Project Planning & Delivery Graduate Programme 2021","Dublin","Ryanair","We are pleased to announce that we are now accepting applications for our IT Project Planning & Delivery Programme starting in September 2021.","Dublin"
"519","Data Engineer - AI","Dublin","Shutterstock","Knowledge of emerging data integration technologies. In this role you will be bringing modern data technologies and practices to enable our talented team of…","Dublin"
"520","Forensic Accountant","Dublin","Red Tree Recruitment","Due to unprecedented growth, we are currently working on behalf of our client to recruit a number of Forensics Accountants. Help with Proposal for Tenders.","Dublin"
"521","Financial Planning Analyst","Galway","Collins McNicholas","Summarise financial data into high quality, accurate and usable summaries. Financial Planning Analyst required with 3 years plus experience in a financial…","Dublin"
"522","Data Analyst","Dublin","Unijobs","Collecting, interpreting, and analysing data. Creating a more efficient data collection and analysis process. The HSE Communications Division is responsible for…","Dublin"
"523","Blockchain Consultant / Senior Producer","Remote","Smith + Crown","3 - 5+ years of experience in a consulting role, ideally management consulting, with client-facing responsibilities and experience managing analysts.","Dublin"
"524","Senior Business Analyst","Dublin","Manpower","Experience of system interfacing and the ability to work and design data sources for reporting highly desired. Excellent facilitation and communication skills.","Dublin"
"525","Senior Business Analyst","Dublin","Bloomberg","Participation in the strategic development of the BDMS core data model. Working with internal and external clients, product development and client services…","Dublin"
"526","Privacy Consultant [Client Facing/Advisory]","Dublin","Red Tree Recruitment","Leading data protection assignments to include; The role will involve; Data Protection assessments, audits & gap analysis, large privacy transformation projects…","Dublin"
"527","Software Quality Engineer","Dublin","Fidelity Investments","Defining test data requirements to support sprint testing. We are seeking a Software Quality Engineer to work within a team of engineers to develop high quality…","Dublin"
"528","Security AI - Analytics Lead","Dublin","Accenture","We have data science teams in Dublin, Spain, China and India who are performing cutting-edge data science experiments and development using the latest…","Dublin"
"529","Temp – Supply Logistics Planning Analyst","Limerick","Regeneron","Executes and designs data analytics that impact overall supply chain. Summary: Functions as part of Supply Chain Logistics and is responsible for IOPS resources…","Dublin"
"530","Business Risk – Manager/Assistant Manager","Dublin","Red Tree Recruitment","Business Risk- Manager/Assistant Manager. Due to continued growth and on behalf of our clients we are now looking to recruit an experienced business risk…","Dublin"
"531","Enterprise Account Executive - Polish market","Dublin","Salesforce","Engages with prospect organizations to position salesforce solutions through strategic value based selling, business case definition, ROI analysis, references…","Dublin"
"532","Workforce Manager","Cork","Amazon Ireland Sup Svcs Ltd","Coordinate with Operations, Capacity Planning, Forecasting and Finance teams to analyse historical data and forecast demand.","Dublin"
"533","Digital Marketing Strategist, Customer Success Acceleration (French)","Dublin","Google","Experience in data analysis and reporting. Analyze data and trends in order to create meaningful insights for customers.","Dublin"
"534","Senior Cyber Incident Response Manager","Dublin","Integrity360","Logical thought mindset and experience developing reusable processes / data architectures. Integrity360 is the largest specialist IT security consultancy in the…","Dublin"
"535","Senior Product Marketing Manager","Dublin","LogMeIn","You will be proficient in drawing insights and creating actionable outcomes from performance data, market research, industry analysis and customer feedback.","Dublin"
"536","eDiscovery Specialist [Lead]","Dublin","Red Tree Recruitment","Manipulating large volumes of unstructured data. Forensically capturing data [navigating Digital systems & files.]. Ability to work to tight deadlines.","Dublin"
"537","Senior Consultant/ Architect in the Infrastructure & Endpoint Security","Dublin","IBM","Named by industry analysts as a leader in 12 security market segment categories, IBM Security is a multi-billion dollar business that is rapidly growing.","Dublin"
"538","Product Manager, Growth - Plans, Payment & Checkout","Dublin","SurveyMonkey","You are hands-on and enjoy investigating the data yourself. Ideally experience with SQL, Google Analytics/Event Tracking or other data tools.","Dublin"
"539","Supplier Project Analyst (P2P)","Cork","Life Science Recruitment","The project analyst is responsible for project documentation and monitoring and plays an important role in both internal and external communication.","Dublin"
"540","Staff Software Engineer, Identity","Dublin","Toast","Toast stores data in a set of sharded Postgres databases and utilizes Apache Spark for large scale data workloads including query and batch processing.","Dublin"
"541","Quality Analyst-Dublin hub-German","Dublin","Bytedance","Conduct root cause data analysis and summary. Conduct quality assessment work by ensuring and evaluating the quality delivery of the content reviewed in…","Dublin"
"542","Technical Analyst","County Mayo","Kelly Services","Carry out data calculations and basic statistics. Kelly Services are recruiting for a fantastic opportunity for a Technical Analyst for our Pharmaceutical…","Dublin"
"543","Agency Development Manager, Customer Solutions (German)","Dublin","Google","Build compelling, data-driven long term agency plans leveraging market insights and research. Our teams of strategists, analysts, advisers and support…","Dublin"
"544","Model Optimization Specialist (German)","Dublin","Bytedance","Experience in ads/content safety or quality analyst related experiences is a plus; Deliver routine tasks such as labelling advertisement data to standardize and…","Dublin"
"545","Agency Development Manager, Google Customer Solutions (English, Dutch)","Dublin","Google","Build compelling, data-driven long-term agency plans leveraging market insights and research. Our teams of strategists, analysts, advisers and support…","Dublin"
"546","DevOps Engineer - VP","Dublin","Citi","Experience with test data migration. Familiarity with data persistence technologies SQL (Oracle). The Engineering Lead Analyst will be a Devops SME for Test…","Dublin"
"547","Business Account Manager- FMCG","Dublin","Amicus Recruitment","Strong data analytics capability, to actively identify business opportunities. You will work within dynamic multi-functional customer teams which include…","Dublin"
"548","Software Test Analyst","Limerick","PBRecruitment Ltd.","Experience in designing and building test environments including synthetic data generation. Our client is a rapidly expanding USA FinTech software company in…","Dublin"
"549","Senior .Net Developer","Dublin","Compass Informatics","You will work in an innovative environment with fellow developers, data analysts, business analysts, and really good and valued clients.","Dublin"
"550","Quality Control Supervisor","Waterford","Matrix Recruitment Group","Leading a team of lab analysts. We collect your data for recruitment purposes only and will retain it for the duration required as outlined in our privacy…","Dublin"
"551","Order to Cash Accounts Receivable Analyst- Dutch","Cork","Morgan McKinley","Prepare & present Quarterly Credit Committee data for Global Treasury and Affiliates CFO's. Order to Cash - Account Receivable Analyst - Dutch.","Dublin"
"552","Quality Control Supervisor","Waterford","Morgan McKinley","Support the S&M department in advancing new products and services to market, developing and validating technical data sheets, answering queries and training.","Dublin"
"553","Cyber Security/Governance Professionals [3+yrs Cyber experience]","Dublin","Red Tree Recruitment","ISO 27001 Certification – protection of privacy, integrity, and accessibility of data information in the Cyberspace. Information Security Governance to include;","Dublin"
"554","Supply Chain Sr. Business Analyst - IT","Cork","Logitech","We are hiring a highly experienced Oracle EBS Supply Chain Sr. Business Analyst (10+ years experience) to join our team. In this role you will:","Dublin"
"555","Information/Cyber Security Consultants","Dublin","Red Tree Recruitment","ISO 27001 Certification – protection of privacy, integrity, and accessibility of data information in the Cyberspace. Information Security Governance to include;","Dublin"
"556","Head of Digital for Operations","Carrigtwohill, County Cork","Merck KGaA","Support the building of overall organisational capability and engagement in digitalisation of operations and the application of data analytics to drive business…","Dublin"
